,sequence,answer_cause,answer_effect,switched,responses_cause,responses_effect,responses_cause_ss,responses_effect_ss
98,Alice ate the last cookie. Bob opened the jar and was frustrated.,Alice ate the last cookie.,Bob opened the jar and was frustrated.,False, Alice ate the last cookie., Bob opened the jar and was frustrated., Bob opened the jar and was frustrated.," Alice ate the last cookie.
Jimmy was late for his date."
99,Bob opened the jar and was frustrated. Alice ate the last cookie.,Alice ate the last cookie.,Bob opened the jar and was frustrated.,True, Alice ate the last cookie., Bob opened the jar and was frustrated., Bob opened the jar and was frustrated., Bob opened the jar and was frustrated.
100,Jimmy took the last piece of cake. Mom rinsed the tray.,Jimmy took the last piece of cake.,Mom rinsed the tray.,False, Jimmy took the last piece of cake., Mom rinsed the tray., Jimmy took the last piece of cake.," Jimmy took the last piece of cake.
The teacher gave the students a report card. The teacher"
101,Mom rinsed the tray. Jimmy took the last piece of cake.,Jimmy took the last piece of cake.,Mom rinsed the tray.,True, Jimmy took the last piece of cake.," Mom rinsed the tray.
Jimmy took the last piece of cake."," Mom rinsed the tray.
Jimmy took the last piece of cake.", Jimmy took the last piece of cake.
